{
  "schemaVersion": 2,
  "id": "nivel-2",
  "name": "Nivel 2",
  "description": "",
  "timeLimitSeconds": 90,
  "gridSize": 1,
  "rooms": [
    {
      "id": "c5ed6841-055e-4111-bad9-87542e3bc6ee",
      "name": "Entrada",
      "type": "small",
      "position": {
        "x": -17,
        "z": -13
      },
      "size": {
        "width": 14,
        "depth": 14
      },
      "entry": {
        "wall": "south",
        "offset": 0
      },
      "blocks": {
        "left": {
          "enabled": false,
          "targetCount": 0,
          "movement": "static"
        },
        "front": {
          "enabled": false,
          "targetCount": 0,
          "movement": "static"
        },
        "right": {
          "enabled": false,
          "targetCount": 0,
          "movement": "static"
        }
      }
    },
    {
      "id": "36ccfdaf-ad42-47ed-b2c3-7f7dbaafb7ac",
      "name": "Salida",
      "type": "small",
      "position": {
        "x": 20,
        "z": -13
      },
      "size": {
        "width": 14,
        "depth": 14
      },
      "entry": {
        "wall": "south",
        "offset": 0
      },
      "blocks": {
        "left": {
          "enabled": false,
          "targetCount": 0,
          "movement": "static"
        },
        "front": {
          "enabled": false,
          "targetCount": 0,
          "movement": "static"
        },
        "right": {
          "enabled": false,
          "targetCount": 0,
          "movement": "static"
        }
      }
    },
    {
      "id": "db464704-7d98-4948-a584-5bd438f0765a",
      "name": "Sala 1",
      "type": "small",
      "position": {
        "x": 2,
        "z": -13
      },
      "size": {
        "width": 14,
        "depth": 14
      },
      "entry": {
        "wall": "west",
        "offset": 0
      },
      "blocks": {
        "left": {
          "enabled": false,
          "targetCount": 0,
          "movement": "static"
        },
        "front": {
          "enabled": true,
          "targetCount": 5,
          "movement": "static"
        },
        "right": {
          "enabled": false,
          "targetCount": 0,
          "movement": "static"
        }
      }
    },
    {
      "id": "b66a5fa9-4d59-4ad2-a4d6-81a82e069236",
      "name": "Sala 3",
      "type": "small",
      "position": {
        "x": 20,
        "z": 14
      },
      "size": {
        "width": 14,
        "depth": 14
      },
      "entry": {
        "wall": "west",
        "offset": 0
      },
      "blocks": {
        "left": {
          "enabled": true,
          "targetCount": 3,
          "movement": "static"
        },
        "front": {
          "enabled": true,
          "targetCount": 5,
          "movement": "opposite"
        },
        "right": {
          "enabled": true,
          "targetCount": 3,
          "movement": "static"
        }
      }
    },
    {
      "id": "0f52fbb4-191a-48dd-9c28-6847d1969589",
      "name": "Sala 2",
      "type": "corridor",
      "position": {
        "x": 2,
        "z": 14
      },
      "size": {
        "width": 10,
        "depth": 28
      },
      "entry": {
        "wall": "north",
        "offset": 0
      },
      "blocks": {
        "left": {
          "enabled": true,
          "targetCount": 5,
          "movement": "opposite"
        },
        "front": {
          "enabled": false,
          "targetCount": 0,
          "movement": "static"
        },
        "right": {
          "enabled": true,
          "targetCount": 5,
          "movement": "opposite"
        }
      }
    }
  ],
  "connections": [
    {
      "id": "0bab22e2-05dd-49b6-995a-4d13b2dc0818",
      "fromRoomId": "c5ed6841-055e-4111-bad9-87542e3bc6ee",
      "toRoomId": "db464704-7d98-4948-a584-5bd438f0765a",
      "fromWall": "east",
      "toWall": "west"
    },
    {
      "id": "ed16a8b0-b7c2-4aba-80a3-dabec8498077",
      "fromRoomId": "db464704-7d98-4948-a584-5bd438f0765a",
      "toRoomId": "0f52fbb4-191a-48dd-9c28-6847d1969589",
      "fromWall": "south",
      "toWall": "north"
    },
    {
      "id": "e1e52d72-ef9d-47cf-b2cc-970d596661ab",
      "fromRoomId": "0f52fbb4-191a-48dd-9c28-6847d1969589",
      "toRoomId": "b66a5fa9-4d59-4ad2-a4d6-81a82e069236",
      "fromWall": "east",
      "toWall": "west"
    },
    {
      "id": "97b31973-3467-4f9c-bf1e-e42a5f0a2aa0",
      "fromRoomId": "b66a5fa9-4d59-4ad2-a4d6-81a82e069236",
      "toRoomId": "36ccfdaf-ad42-47ed-b2c3-7f7dbaafb7ac",
      "fromWall": "north",
      "toWall": "south"
    }
  ]
}
